ApplicationID,JobID,ApplicantID,TimeOfApplication,CV,StatementOfPurpose,ExpectToGain,Questions,ApplicationStatus
284,984,168,03/06/2021 12:18,Sit.jpeg,Integer ac leo. Pellentesque ultrices mattis odio. Donec vitae nisi.,Phasellus in felis. Donec semper sapien a libero. Nam dui.,Etiam vel augue. Vestibulum rutrum rutrum neque. Aenean auctor gravida sem.,Interviewing
287,360,988,14/02/2021 7:56,Duis.mov,Suspendisse potenti. In eleifend quam a odio. In hac habitasse platea dictumst.,"Morbi porttitor lorem id ligula. Suspendisse ornare consequat lectus. In est risus, auctor sed, tristique in, tempus sit amet, sem.","Morbi porttitor lorem id ligula. Suspendisse ornare consequat lectus. In est risus, auctor sed, tristique in, tempus sit amet, sem.",Interviewing
306,97,186,07/06/2021 6:00,Est.mp3,"Proin leo odio, porttitor id, consequat in, consequat ut, nulla. Sed accumsan felis. Ut at dolor quis odio consequat varius.",Fusce consequat. Nulla nisl. Nunc nisl.,"Maecenas leo odio, condimentum id, luctus nec, molestie sed, justo. Pellentesque viverra pede ac diam. Cras pellentesque volutpat dui.",Interviewing
310,324,642,08/12/2021 10:26,CongueVivamus.ppt,Pellentesque at nulla. Suspendisse potenti. Cras in purus eu magna vulputate luctus.,Praesent id massa id nisl venenatis lacinia. Aenean sit amet justo. Morbi ut odio.,,Interviewing
312,213,372,18/09/2021 11:45,Vestibulum.jpeg,Nullam porttitor lacus at turpis. Donec posuere metus vitae ipsum. Aliquam non mauris.,"Duis bibendum, felis sed interdum venenatis, turpis enim blandit mi, in porttitor pede justo eu massa. Donec dapibus. Duis at velit eu est congue elementum.","Donec diam neque, vestibulum eget, vulputate ut, ultrices vel, augue. Vestibulum ante ipsum primis in faucibus orci luctus et ultrices posuere cubilia Curae; Donec pharetra, magna vestibulum aliquet ultrices, erat tortor sollicitudin mi, sit amet lobortis sapien sapien non mi. Integer ac neque.",Interviewing
313,293,458,13/10/2021 22:44,Tempus.pdf,"Morbi non lectus. Aliquam sit amet diam in magna bibendum imperdiet. Nullam orci pede, venenatis non, sodales sed, tincidunt eu, felis.","Vestibulum quam sapien, varius ut, blandit non, interdum in, ante. Vestibulum ante ipsum primis in faucibus orci luctus et ultrices posuere cubilia Curae; Duis faucibus accumsan odio. Curabitur convallis.",Aliquam quis turpis eget elit sodales scelerisque. Mauris sit amet eros. Suspendisse accumsan tortor quis turpis.,Interviewing
314,932,713,24/03/2021 7:18,InTempor.tiff,Phasellus sit amet erat. Nulla tempus. Vivamus in felis eu sapien cursus vestibulum.,"Aenean fermentum. Donec ut mauris eget massa tempor convallis. Nulla neque libero, convallis eget, eleifend luctus, ultricies eu, nibh.",Nullam porttitor lacus at turpis. Donec posuere metus vitae ipsum. Aliquam non mauris.,Interviewing
316,639,255,20/02/2021 2:55,SuspendisseAccumsan.avi,In congue. Etiam justo. Etiam pretium iaculis justo.,Maecenas ut massa quis augue luctus tincidunt. Nulla mollis molestie lorem. Quisque ut erat.,"Nam ultrices, libero non mattis pulvinar, nulla pede ullamcorper augue, a suscipit nulla elit ac nulla. Sed vel enim sit amet nunc viverra dapibus. Nulla suscipit ligula in lacus.",Interviewing
317,957,331,13/03/2021 8:36,Eu.ppt,"Vestibulum ac est lacinia nisi venenatis tristique. Fusce congue, diam id ornare imperdiet, sapien urna pretium nisl, ut volutpat sapien arcu sed augue. Aliquam erat volutpat.","Proin eu mi. Nulla ac enim. In tempor, turpis nec euismod scelerisque, quam turpis adipiscing lorem, vitae mattis nibh ligula nec sem.",,Interviewing
322,801,37,23/03/2021 19:16,JustoEuMassa.doc,Nullam porttitor lacus at turpis. Donec posuere metus vitae ipsum. Aliquam non mauris.,"Quisque porta volutpat erat. Quisque erat eros, viverra eget, congue eget, semper rutrum, nulla. Nunc purus.",Fusce consequat. Nulla nisl. Nunc nisl.,Interviewing
331,764,354,07/09/2021 19:03,Posuere.txt,"Praesent blandit. Nam nulla. Integer pede justo, lacinia eget, tincidunt eget, tempus vel, pede.",Duis consequat dui nec nisi volutpat eleifend. Donec ut dolor. Morbi vel lectus in quam fringilla rhoncus.,Nullam sit amet turpis elementum ligula vehicula consequat. Morbi a ipsum. Integer a nibh.,Interviewing
332,300,767,05/10/2021 12:20,PlaceratAnteNulla.avi,Fusce consequat. Nulla nisl. Nunc nisl.,"Duis bibendum, felis sed interdum venenatis, turpis enim blandit mi, in porttitor pede justo eu massa. Donec dapibus. Duis at velit eu est congue elementum.","Morbi non lectus. Aliquam sit amet diam in magna bibendum imperdiet. Nullam orci pede, venenatis non, sodales sed, tincidunt eu, felis.",Interviewing
335,12,396,28/08/2021 23:24,ScelerisqueMaurisSit.tiff,Duis consequat dui nec nisi volutpat eleifend. Donec ut dolor. Morbi vel lectus in quam fringilla rhoncus.,Integer tincidunt ante vel ipsum. Praesent blandit lacinia erat. Vestibulum sed magna at nunc commodo placerat.,Duis bibendum. Morbi non quam nec dui luctus rutrum. Nulla tellus.,Interviewing
338,598,453,29/04/2021 3:30,NisiNamUltrices.doc,"Proin eu mi. Nulla ac enim. In tempor, turpis nec euismod scelerisque, quam turpis adipiscing lorem, vitae mattis nibh ligula nec sem.","Curabitur in libero ut massa volutpat convallis. Morbi odio odio, elementum eu, interdum eu, tincidunt in, leo. Maecenas pulvinar lobortis est.",Nullam sit amet turpis elementum ligula vehicula consequat. Morbi a ipsum. Integer a nibh.,Interviewing
339,292,811,05/12/2021 22:29,IdSapienIn.xls,"Vestibulum ac est lacinia nisi venenatis tristique. Fusce congue, diam id ornare imperdiet, sapien urna pretium nisl, ut volutpat sapien arcu sed augue. Aliquam erat volutpat.",Suspendisse potenti. In eleifend quam a odio. In hac habitasse platea dictumst.,Duis aliquam convallis nunc. Proin at turpis a pede posuere nonummy. Integer non velit.,Interviewing
340,454,931,06/03/2021 0:39,MiInteger.tiff,Maecenas ut massa quis augue luctus tincidunt. Nulla mollis molestie lorem. Quisque ut erat.,"Mauris enim leo, rhoncus sed, vestibulum sit amet, cursus id, turpis. Integer aliquet, massa id lobortis convallis, tortor risus dapibus augue, vel accumsan tellus nisi eu orci. Mauris lacinia sapien quis libero.",,Interviewing
350,172,449,01/06/2021 11:44,AugueVestibulumRutrum.doc,Nullam sit amet turpis elementum ligula vehicula consequat. Morbi a ipsum. Integer a nibh.,In hac habitasse platea dictumst. Etiam faucibus cursus urna. Ut tellus.,Phasellus sit amet erat. Nulla tempus. Vivamus in felis eu sapien cursus vestibulum.,Interviewing
353,423,862,30/10/2021 17:57,Cras.mp3,"Nam ultrices, libero non mattis pulvinar, nulla pede ullamcorper augue, a suscipit nulla elit ac nulla. Sed vel enim sit amet nunc viverra dapibus. Nulla suscipit ligula in lacus.","Proin interdum mauris non ligula pellentesque ultrices. Phasellus id sapien in sapien iaculis congue. Vivamus metus arcu, adipiscing molestie, hendrerit at, vulputate vitae, nisl.","Nam ultrices, libero non mattis pulvinar, nulla pede ullamcorper augue, a suscipit nulla elit ac nulla. Sed vel enim sit amet nunc viverra dapibus. Nulla suscipit ligula in lacus.",Interviewing
372,656,40,23/08/2021 5:46,NullaInteger.mov,Pellentesque at nulla. Suspendisse potenti. Cras in purus eu magna vulputate luctus.,Duis consequat dui nec nisi volutpat eleifend. Donec ut dolor. Morbi vel lectus in quam fringilla rhoncus.,"Praesent blandit. Nam nulla. Integer pede justo, lacinia eget, tincidunt eget, tempus vel, pede.",Interviewing
375,437,308,13/02/2021 3:24,TinciduntEget.xls,Phasellus in felis. Donec semper sapien a libero. Nam dui.,"Proin leo odio, porttitor id, consequat in, consequat ut, nulla. Sed accumsan felis. Ut at dolor quis odio consequat varius.","Morbi non lectus. Aliquam sit amet diam in magna bibendum imperdiet. Nullam orci pede, venenatis non, sodales sed, tincidunt eu, felis.",Interviewing
384,811,856,07/06/2021 4:10,NullamPorttitor.mp3,In congue. Etiam justo. Etiam pretium iaculis justo.,"Fusce posuere felis sed lacus. Morbi sem mauris, laoreet ut, rhoncus aliquet, pulvinar sed, nisl. Nunc rhoncus dui vel sem.",,Interviewing
388,252,767,22/11/2021 10:38,Ipsum.ppt,Duis aliquam convallis nunc. Proin at turpis a pede posuere nonummy. Integer non velit.,In congue. Etiam justo. Etiam pretium iaculis justo.,Integer tincidunt ante vel ipsum. Praesent blandit lacinia erat. Vestibulum sed magna at nunc commodo placerat.,Interviewing
396,518,83,25/07/2021 7:34,Primis.ppt,"Curabitur gravida nisi at nibh. In hac habitasse platea dictumst. Aliquam augue quam, sollicitudin vitae, consectetuer eget, rutrum at, lorem.",Aenean lectus. Pellentesque eget nunc. Donec quis orci eget orci vehicula condimentum.,"Lorem ipsum dolor sit amet, consectetuer adipiscing elit. Proin risus. Praesent lectus.",Interviewing
402,782,188,26/08/2021 18:48,Blandit.mpeg,"Lorem ipsum dolor sit amet, consectetuer adipiscing elit. Proin risus. Praesent lectus.","Aenean fermentum. Donec ut mauris eget massa tempor convallis. Nulla neque libero, convallis eget, eleifend luctus, ultricies eu, nibh.","Fusce posuere felis sed lacus. Morbi sem mauris, laoreet ut, rhoncus aliquet, pulvinar sed, nisl. Nunc rhoncus dui vel sem.",Interviewing
403,852,98,01/08/2021 19:02,IntegerPedeJusto.xls,"Aenean fermentum. Donec ut mauris eget massa tempor convallis. Nulla neque libero, convallis eget, eleifend luctus, ultricies eu, nibh.",Cras non velit nec nisi vulputate nonummy. Maecenas tincidunt lacus at velit. Vivamus vel nulla eget eros elementum pellentesque.,,Interviewing
405,555,148,25/02/2021 5:01,ParturientMontes.tiff,Nullam porttitor lacus at turpis. Donec posuere metus vitae ipsum. Aliquam non mauris.,Maecenas ut massa quis augue luctus tincidunt. Nulla mollis molestie lorem. Quisque ut erat.,,Interviewing
409,698,499,04/02/2021 5:10,Aliquet.avi,"Praesent blandit. Nam nulla. Integer pede justo, lacinia eget, tincidunt eget, tempus vel, pede.","Cum sociis natoque penatibus et magnis dis parturient montes, nascetur ridiculus mus. Vivamus vestibulum sagittis sapien. Cum sociis natoque penatibus et magnis dis parturient montes, nascetur ridiculus mus.",,Interviewing
410,572,585,30/01/2021 15:53,NequeDuis.mp3,"Praesent blandit. Nam nulla. Integer pede justo, lacinia eget, tincidunt eget, tempus vel, pede.",Integer tincidunt ante vel ipsum. Praesent blandit lacinia erat. Vestibulum sed magna at nunc commodo placerat.,"Lorem ipsum dolor sit amet, consectetuer adipiscing elit. Proin risus. Praesent lectus.",Interviewing
420,913,682,03/12/2021 20:53,OrciMaurisLacinia.mp3,"Cum sociis natoque penatibus et magnis dis parturient montes, nascetur ridiculus mus. Vivamus vestibulum sagittis sapien. Cum sociis natoque penatibus et magnis dis parturient montes, nascetur ridiculus mus.",Fusce consequat. Nulla nisl. Nunc nisl.,"Morbi non lectus. Aliquam sit amet diam in magna bibendum imperdiet. Nullam orci pede, venenatis non, sodales sed, tincidunt eu, felis.",Interviewing
426,318,709,19/07/2021 16:11,NullaTellus.avi,Cras non velit nec nisi vulputate nonummy. Maecenas tincidunt lacus at velit. Vivamus vel nulla eget eros elementum pellentesque.,"Mauris enim leo, rhoncus sed, vestibulum sit amet, cursus id, turpis. Integer aliquet, massa id lobortis convallis, tortor risus dapibus augue, vel accumsan tellus nisi eu orci. Mauris lacinia sapien quis libero.",Suspendisse potenti. In eleifend quam a odio. In hac habitasse platea dictumst.,Interviewing
439,656,672,22/07/2021 7:17,IdLuctus.ppt,Pellentesque at nulla. Suspendisse potenti. Cras in purus eu magna vulputate luctus.,Maecenas ut massa quis augue luctus tincidunt. Nulla mollis molestie lorem. Quisque ut erat.,"Mauris enim leo, rhoncus sed, vestibulum sit amet, cursus id, turpis. Integer aliquet, massa id lobortis convallis, tortor risus dapibus augue, vel accumsan tellus nisi eu orci. Mauris lacinia sapien quis libero.",Interviewing
443,208,830,14/12/2021 21:19,Vel.avi,"Proin interdum mauris non ligula pellentesque ultrices. Phasellus id sapien in sapien iaculis congue. Vivamus metus arcu, adipiscing molestie, hendrerit at, vulputate vitae, nisl.","Curabitur gravida nisi at nibh. In hac habitasse platea dictumst. Aliquam augue quam, sollicitudin vitae, consectetuer eget, rutrum at, lorem.",Maecenas ut massa quis augue luctus tincidunt. Nulla mollis molestie lorem. Quisque ut erat.,Interviewing
449,410,509,14/03/2021 4:55,MassaIdLobortis.avi,"Mauris enim leo, rhoncus sed, vestibulum sit amet, cursus id, turpis. Integer aliquet, massa id lobortis convallis, tortor risus dapibus augue, vel accumsan tellus nisi eu orci. Mauris lacinia sapien quis libero.","Morbi porttitor lorem id ligula. Suspendisse ornare consequat lectus. In est risus, auctor sed, tristique in, tempus sit amet, sem.",,Interviewing
458,672,998,17/09/2021 0:57,Praesent.mp3,"Mauris enim leo, rhoncus sed, vestibulum sit amet, cursus id, turpis. Integer aliquet, massa id lobortis convallis, tortor risus dapibus augue, vel accumsan tellus nisi eu orci. Mauris lacinia sapien quis libero.","Fusce posuere felis sed lacus. Morbi sem mauris, laoreet ut, rhoncus aliquet, pulvinar sed, nisl. Nunc rhoncus dui vel sem.","Nam ultrices, libero non mattis pulvinar, nulla pede ullamcorper augue, a suscipit nulla elit ac nulla. Sed vel enim sit amet nunc viverra dapibus. Nulla suscipit ligula in lacus.",Interviewing
462,501,271,05/03/2021 10:28,Mattis.ppt,"In sagittis dui vel nisl. Duis ac nibh. Fusce lacus purus, aliquet at, feugiat non, pretium quis, lectus.","Lorem ipsum dolor sit amet, consectetuer adipiscing elit. Proin risus. Praesent lectus.","Praesent blandit. Nam nulla. Integer pede justo, lacinia eget, tincidunt eget, tempus vel, pede.",Interviewing
478,903,609,09/11/2021 16:32,Diam.txt,Integer ac leo. Pellentesque ultrices mattis odio. Donec vitae nisi.,"In sagittis dui vel nisl. Duis ac nibh. Fusce lacus purus, aliquet at, feugiat non, pretium quis, lectus.",,Interviewing
500,576,17,08/04/2021 7:35,NullaSuspendissePotenti.xls,"Aenean fermentum. Donec ut mauris eget massa tempor convallis. Nulla neque libero, convallis eget, eleifend luctus, ultricies eu, nibh.","Curabitur at ipsum ac tellus semper interdum. Mauris ullamcorper purus sit amet nulla. Quisque arcu libero, rutrum ac, lobortis vel, dapibus at, diam.","Cum sociis natoque penatibus et magnis dis parturient montes, nascetur ridiculus mus. Vivamus vestibulum sagittis sapien. Cum sociis natoque penatibus et magnis dis parturient montes, nascetur ridiculus mus.",Interviewing
501,860,219,05/01/2021 8:59,Sed.ppt,"Nam ultrices, libero non mattis pulvinar, nulla pede ullamcorper augue, a suscipit nulla elit ac nulla. Sed vel enim sit amet nunc viverra dapibus. Nulla suscipit ligula in lacus.",Phasellus sit amet erat. Nulla tempus. Vivamus in felis eu sapien cursus vestibulum.,Suspendisse potenti. In eleifend quam a odio. In hac habitasse platea dictumst.,Interviewing
502,871,306,27/07/2021 19:02,Volutpat.ppt,"Aenean fermentum. Donec ut mauris eget massa tempor convallis. Nulla neque libero, convallis eget, eleifend luctus, ultricies eu, nibh.","Morbi non lectus. Aliquam sit amet diam in magna bibendum imperdiet. Nullam orci pede, venenatis non, sodales sed, tincidunt eu, felis.",Cras non velit nec nisi vulputate nonummy. Maecenas tincidunt lacus at velit. Vivamus vel nulla eget eros elementum pellentesque.,Interviewing
509,260,820,05/09/2021 2:13,Metus.doc,"Morbi non lectus. Aliquam sit amet diam in magna bibendum imperdiet. Nullam orci pede, venenatis non, sodales sed, tincidunt eu, felis.","Duis bibendum, felis sed interdum venenatis, turpis enim blandit mi, in porttitor pede justo eu massa. Donec dapibus. Duis at velit eu est congue elementum.","Duis bibendum, felis sed interdum venenatis, turpis enim blandit mi, in porttitor pede justo eu massa. Donec dapibus. Duis at velit eu est congue elementum.",Interviewing
511,699,18,19/07/2021 2:06,Pretium.xls,"Maecenas leo odio, condimentum id, luctus nec, molestie sed, justo. Pellentesque viverra pede ac diam. Cras pellentesque volutpat dui.",Duis consequat dui nec nisi volutpat eleifend. Donec ut dolor. Morbi vel lectus in quam fringilla rhoncus.,,Interviewing
512,76,242,09/06/2021 17:43,Vel.mp3,"Mauris enim leo, rhoncus sed, vestibulum sit amet, cursus id, turpis. Integer aliquet, massa id lobortis convallis, tortor risus dapibus augue, vel accumsan tellus nisi eu orci. Mauris lacinia sapien quis libero.",Fusce consequat. Nulla nisl. Nunc nisl.,In congue. Etiam justo. Etiam pretium iaculis justo.,Interviewing
518,884,44,22/12/2021 21:30,ScelerisqueQuamTurpis.xls,"Morbi porttitor lorem id ligula. Suspendisse ornare consequat lectus. In est risus, auctor sed, tristique in, tempus sit amet, sem.",In congue. Etiam justo. Etiam pretium iaculis justo.,,Interviewing
521,876,728,21/12/2021 13:31,MiPede.xls,"Sed sagittis. Nam congue, risus semper porta volutpat, quam pede lobortis ligula, sit amet eleifend pede libero quis orci. Nullam molestie nibh in lectus.","Sed sagittis. Nam congue, risus semper porta volutpat, quam pede lobortis ligula, sit amet eleifend pede libero quis orci. Nullam molestie nibh in lectus.",,Interviewing
523,601,944,01/10/2021 10:17,Ultrices.tiff,Duis consequat dui nec nisi volutpat eleifend. Donec ut dolor. Morbi vel lectus in quam fringilla rhoncus.,"Curabitur in libero ut massa volutpat convallis. Morbi odio odio, elementum eu, interdum eu, tincidunt in, leo. Maecenas pulvinar lobortis est.","Quisque id justo sit amet sapien dignissim vestibulum. Vestibulum ante ipsum primis in faucibus orci luctus et ultrices posuere cubilia Curae; Nulla dapibus dolor vel est. Donec odio justo, sollicitudin ut, suscipit a, feugiat et, eros.",Interviewing
526,369,468,01/06/2021 2:55,ConvallisNuncProin.avi,"Aenean fermentum. Donec ut mauris eget massa tempor convallis. Nulla neque libero, convallis eget, eleifend luctus, ultricies eu, nibh.","Cum sociis natoque penatibus et magnis dis parturient montes, nascetur ridiculus mus. Vivamus vestibulum sagittis sapien. Cum sociis natoque penatibus et magnis dis parturient montes, nascetur ridiculus mus.",Nullam sit amet turpis elementum ligula vehicula consequat. Morbi a ipsum. Integer a nibh.,Interviewing
533,547,1,11/10/2021 10:46,Venenatis.mp3,Maecenas ut massa quis augue luctus tincidunt. Nulla mollis molestie lorem. Quisque ut erat.,"Praesent blandit. Nam nulla. Integer pede justo, lacinia eget, tincidunt eget, tempus vel, pede.",Fusce consequat. Nulla nisl. Nunc nisl.,Interviewing
543,29,867,09/06/2021 16:30,TristiqueFusceCongue.tiff,"Quisque id justo sit amet sapien dignissim vestibulum. Vestibulum ante ipsum primis in faucibus orci luctus et ultrices posuere cubilia Curae; Nulla dapibus dolor vel est. Donec odio justo, sollicitudin ut, suscipit a, feugiat et, eros.",Nullam sit amet turpis elementum ligula vehicula consequat. Morbi a ipsum. Integer a nibh.,Praesent id massa id nisl venenatis lacinia. Aenean sit amet justo. Morbi ut odio.,Interviewing
545,141,5,21/11/2021 16:46,FermentumJustoNec.pdf,"Quisque id justo sit amet sapien dignissim vestibulum. Vestibulum ante ipsum primis in faucibus orci luctus et ultrices posuere cubilia Curae; Nulla dapibus dolor vel est. Donec odio justo, sollicitudin ut, suscipit a, feugiat et, eros.",Aenean lectus. Pellentesque eget nunc. Donec quis orci eget orci vehicula condimentum.,"Proin interdum mauris non ligula pellentesque ultrices. Phasellus id sapien in sapien iaculis congue. Vivamus metus arcu, adipiscing molestie, hendrerit at, vulputate vitae, nisl.",Interviewing
546,95,200,28/10/2021 11:09,Lorem.avi,"Lorem ipsum dolor sit amet, consectetuer adipiscing elit. Proin risus. Praesent lectus.","Praesent blandit. Nam nulla. Integer pede justo, lacinia eget, tincidunt eget, tempus vel, pede.","Cum sociis natoque penatibus et magnis dis parturient montes, nascetur ridiculus mus. Vivamus vestibulum sagittis sapien. Cum sociis natoque penatibus et magnis dis parturient montes, nascetur ridiculus mus.",Interviewing
551,583,706,09/08/2021 16:45,HabitassePlateaDictumst.jpeg,Pellentesque at nulla. Suspendisse potenti. Cras in purus eu magna vulputate luctus.,"Donec diam neque, vestibulum eget, vulputate ut, ultrices vel, augue. Vestibulum ante ipsum primis in faucibus orci luctus et ultrices posuere cubilia Curae; Donec pharetra, magna vestibulum aliquet ultrices, erat tortor sollicitudin mi, sit amet lobortis sapien sapien non mi. Integer ac neque.","Nam ultrices, libero non mattis pulvinar, nulla pede ullamcorper augue, a suscipit nulla elit ac nulla. Sed vel enim sit amet nunc viverra dapibus. Nulla suscipit ligula in lacus.",Interviewing
553,753,105,26/11/2021 12:10,EstDonec.mov,"Donec diam neque, vestibulum eget, vulputate ut, ultrices vel, augue. Vestibulum ante ipsum primis in faucibus orci luctus et ultrices posuere cubilia Curae; Donec pharetra, magna vestibulum aliquet ultrices, erat tortor sollicitudin mi, sit amet lobortis sapien sapien non mi. Integer ac neque.",Integer tincidunt ante vel ipsum. Praesent blandit lacinia erat. Vestibulum sed magna at nunc commodo placerat.,"Maecenas tristique, est et tempus semper, est quam pharetra magna, ac consequat metus sapien ut nunc. Vestibulum ante ipsum primis in faucibus orci luctus et ultrices posuere cubilia Curae; Mauris viverra diam vitae quam. Suspendisse potenti.",Interviewing
567,426,772,07/07/2021 5:23,MaurisLacinia.png,"Proin leo odio, porttitor id, consequat in, consequat ut, nulla. Sed accumsan felis. Ut at dolor quis odio consequat varius.",Cras non velit nec nisi vulputate nonummy. Maecenas tincidunt lacus at velit. Vivamus vel nulla eget eros elementum pellentesque.,Nulla ut erat id mauris vulputate elementum. Nullam varius. Nulla facilisi.,Interviewing
574,912,636,28/01/2021 18:42,NullamPorttitor.xls,Etiam vel augue. Vestibulum rutrum rutrum neque. Aenean auctor gravida sem.,In quis justo. Maecenas rhoncus aliquam lacus. Morbi quis tortor id nulla ultrices aliquet.,Etiam vel augue. Vestibulum rutrum rutrum neque. Aenean auctor gravida sem.,Interviewing
581,136,878,27/02/2021 3:27,MagnaAt.pdf,"Quisque porta volutpat erat. Quisque erat eros, viverra eget, congue eget, semper rutrum, nulla. Nunc purus.",Sed ante. Vivamus tortor. Duis mattis egestas metus.,Nullam porttitor lacus at turpis. Donec posuere metus vitae ipsum. Aliquam non mauris.,Interviewing
583,49,60,07/05/2021 19:30,UrnaUt.jpeg,"Fusce posuere felis sed lacus. Morbi sem mauris, laoreet ut, rhoncus aliquet, pulvinar sed, nisl. Nunc rhoncus dui vel sem.","Curabitur gravida nisi at nibh. In hac habitasse platea dictumst. Aliquam augue quam, sollicitudin vitae, consectetuer eget, rutrum at, lorem.",Praesent id massa id nisl venenatis lacinia. Aenean sit amet justo. Morbi ut odio.,Interviewing
587,889,417,06/07/2021 0:35,OdioCurabitur.mov,"In hac habitasse platea dictumst. Morbi vestibulum, velit id pretium iaculis, diam erat fermentum justo, nec condimentum neque sapien placerat ante. Nulla justo.",Praesent id massa id nisl venenatis lacinia. Aenean sit amet justo. Morbi ut odio.,Phasellus sit amet erat. Nulla tempus. Vivamus in felis eu sapien cursus vestibulum.,Interviewing
592,248,789,21/06/2021 15:09,LuctusCum.mpeg,"Fusce posuere felis sed lacus. Morbi sem mauris, laoreet ut, rhoncus aliquet, pulvinar sed, nisl. Nunc rhoncus dui vel sem.",Cras non velit nec nisi vulputate nonummy. Maecenas tincidunt lacus at velit. Vivamus vel nulla eget eros elementum pellentesque.,Sed ante. Vivamus tortor. Duis mattis egestas metus.,Interviewing
599,424,817,06/01/2021 22:45,Suspendisse.xls,"Quisque porta volutpat erat. Quisque erat eros, viverra eget, congue eget, semper rutrum, nulla. Nunc purus.","Curabitur in libero ut massa volutpat convallis. Morbi odio odio, elementum eu, interdum eu, tincidunt in, leo. Maecenas pulvinar lobortis est.",,Interviewing
603,180,512,05/04/2021 3:54,Et.avi,Sed ante. Vivamus tortor. Duis mattis egestas metus.,"Vestibulum quam sapien, varius ut, blandit non, interdum in, ante. Vestibulum ante ipsum primis in faucibus orci luctus et ultrices posuere cubilia Curae; Duis faucibus accumsan odio. Curabitur convallis.","Duis bibendum, felis sed interdum venenatis, turpis enim blandit mi, in porttitor pede justo eu massa. Donec dapibus. Duis at velit eu est congue elementum.",Interviewing
613,899,64,14/09/2021 19:48,DonecOdio.xls,"Fusce posuere felis sed lacus. Morbi sem mauris, laoreet ut, rhoncus aliquet, pulvinar sed, nisl. Nunc rhoncus dui vel sem.",Duis aliquam convallis nunc. Proin at turpis a pede posuere nonummy. Integer non velit.,,Interviewing
620,297,397,18/01/2021 14:57,DiamNam.tiff,Nullam sit amet turpis elementum ligula vehicula consequat. Morbi a ipsum. Integer a nibh.,Aenean lectus. Pellentesque eget nunc. Donec quis orci eget orci vehicula condimentum.,,Interviewing
628,816,487,23/01/2021 22:16,ProinInterdum.doc,Aenean lectus. Pellentesque eget nunc. Donec quis orci eget orci vehicula condimentum.,"Quisque id justo sit amet sapien dignissim vestibulum. Vestibulum ante ipsum primis in faucibus orci luctus et ultrices posuere cubilia Curae; Nulla dapibus dolor vel est. Donec odio justo, sollicitudin ut, suscipit a, feugiat et, eros.",Praesent id massa id nisl venenatis lacinia. Aenean sit amet justo. Morbi ut odio.,Interviewing
630,747,556,18/02/2021 17:38,Tempus.ppt,Pellentesque at nulla. Suspendisse potenti. Cras in purus eu magna vulputate luctus.,"Mauris enim leo, rhoncus sed, vestibulum sit amet, cursus id, turpis. Integer aliquet, massa id lobortis convallis, tortor risus dapibus augue, vel accumsan tellus nisi eu orci. Mauris lacinia sapien quis libero.","In sagittis dui vel nisl. Duis ac nibh. Fusce lacus purus, aliquet at, feugiat non, pretium quis, lectus.",Interviewing
