ApplicationID,JobID,ApplicantID,TimeOfApplication,CV,StatementOfPurpose,ExpectToGain,Questions,ApplicationStatus
421,541,286,16/03/2021 13:31,Ante.xls,"Quisque id justo sit amet sapien dignissim vestibulum. Vestibulum ante ipsum primis in faucibus orci luctus et ultrices posuere cubilia Curae; Nulla dapibus dolor vel est. Donec odio justo, sollicitudin ut, suscipit a, feugiat et, eros.",Duis bibendum. Morbi non quam nec dui luctus rutrum. Nulla tellus.,"Maecenas tristique, est et tempus semper, est quam pharetra magna, ac consequat metus sapien ut nunc. Vestibulum ante ipsum primis in faucibus orci luctus et ultrices posuere cubilia Curae; Mauris viverra diam vitae quam. Suspendisse potenti.",Reviewing
424,231,974,20/08/2021 18:00,NullaUt.avi,Duis bibendum. Morbi non quam nec dui luctus rutrum. Nulla tellus.,"Proin leo odio, porttitor id, consequat in, consequat ut, nulla. Sed accumsan felis. Ut at dolor quis odio consequat varius.","Vestibulum ac est lacinia nisi venenatis tristique. Fusce congue, diam id ornare imperdiet, sapien urna pretium nisl, ut volutpat sapien arcu sed augue. Aliquam erat volutpat.",Reviewing
429,37,525,03/06/2021 20:48,AmetCursusId.xls,"Cum sociis natoque penatibus et magnis dis parturient montes, nascetur ridiculus mus. Vivamus vestibulum sagittis sapien. Cum sociis natoque penatibus et magnis dis parturient montes, nascetur ridiculus mus.","Maecenas leo odio, condimentum id, luctus nec, molestie sed, justo. Pellentesque viverra pede ac diam. Cras pellentesque volutpat dui.",Aliquam quis turpis eget elit sodales scelerisque. Mauris sit amet eros. Suspendisse accumsan tortor quis turpis.,Reviewing
432,453,191,05/07/2021 12:27,UtOdio.mp3,"Vestibulum quam sapien, varius ut, blandit non, interdum in, ante. Vestibulum ante ipsum primis in faucibus orci luctus et ultrices posuere cubilia Curae; Duis faucibus accumsan odio. Curabitur convallis.",Cras non velit nec nisi vulputate nonummy. Maecenas tincidunt lacus at velit. Vivamus vel nulla eget eros elementum pellentesque.,"Proin leo odio, porttitor id, consequat in, consequat ut, nulla. Sed accumsan felis. Ut at dolor quis odio consequat varius.",Reviewing
438,369,177,10/05/2021 20:28,Montes.avi,Aliquam quis turpis eget elit sodales scelerisque. Mauris sit amet eros. Suspendisse accumsan tortor quis turpis.,"Curabitur gravida nisi at nibh. In hac habitasse platea dictumst. Aliquam augue quam, sollicitudin vitae, consectetuer eget, rutrum at, lorem.",Suspendisse potenti. In eleifend quam a odio. In hac habitasse platea dictumst.,Reviewing
441,874,539,18/11/2021 14:35,Metus.xls,Duis bibendum. Morbi non quam nec dui luctus rutrum. Nulla tellus.,"Aenean fermentum. Donec ut mauris eget massa tempor convallis. Nulla neque libero, convallis eget, eleifend luctus, ultricies eu, nibh.",Pellentesque at nulla. Suspendisse potenti. Cras in purus eu magna vulputate luctus.,Reviewing
450,307,653,29/07/2021 3:16,LuctusRutrumNulla.jpeg,In hac habitasse platea dictumst. Etiam faucibus cursus urna. Ut tellus.,Duis aliquam convallis nunc. Proin at turpis a pede posuere nonummy. Integer non velit.,"In sagittis dui vel nisl. Duis ac nibh. Fusce lacus purus, aliquet at, feugiat non, pretium quis, lectus.",Reviewing
451,583,125,14/02/2021 11:36,QuisOrciNullam.xls,"Maecenas leo odio, condimentum id, luctus nec, molestie sed, justo. Pellentesque viverra pede ac diam. Cras pellentesque volutpat dui.",Pellentesque at nulla. Suspendisse potenti. Cras in purus eu magna vulputate luctus.,"Curabitur at ipsum ac tellus semper interdum. Mauris ullamcorper purus sit amet nulla. Quisque arcu libero, rutrum ac, lobortis vel, dapibus at, diam.",Reviewing
460,392,217,12/09/2021 9:45,DiamCrasPellentesque.gif,"Proin leo odio, porttitor id, consequat in, consequat ut, nulla. Sed accumsan felis. Ut at dolor quis odio consequat varius.","Sed sagittis. Nam congue, risus semper porta volutpat, quam pede lobortis ligula, sit amet eleifend pede libero quis orci. Nullam molestie nibh in lectus.",Duis bibendum. Morbi non quam nec dui luctus rutrum. Nulla tellus.,Reviewing
473,168,920,26/01/2021 9:13,DictumstMorbi.xls,"Praesent blandit. Nam nulla. Integer pede justo, lacinia eget, tincidunt eget, tempus vel, pede.","Aenean fermentum. Donec ut mauris eget massa tempor convallis. Nulla neque libero, convallis eget, eleifend luctus, ultricies eu, nibh.",,Reviewing
493,108,226,07/03/2021 3:24,OrnareImperdiet.gif,Aliquam quis turpis eget elit sodales scelerisque. Mauris sit amet eros. Suspendisse accumsan tortor quis turpis.,"Morbi porttitor lorem id ligula. Suspendisse ornare consequat lectus. In est risus, auctor sed, tristique in, tempus sit amet, sem.",Nullam sit amet turpis elementum ligula vehicula consequat. Morbi a ipsum. Integer a nibh.,Reviewing
503,707,764,02/04/2021 2:51,IdNisl.tiff,"Vestibulum ac est lacinia nisi venenatis tristique. Fusce congue, diam id ornare imperdiet, sapien urna pretium nisl, ut volutpat sapien arcu sed augue. Aliquam erat volutpat.",Pellentesque at nulla. Suspendisse potenti. Cras in purus eu magna vulputate luctus.,Phasellus sit amet erat. Nulla tempus. Vivamus in felis eu sapien cursus vestibulum.,Reviewing
506,858,786,29/08/2021 13:06,MusVivamusVestibulum.ppt,Nullam porttitor lacus at turpis. Donec posuere metus vitae ipsum. Aliquam non mauris.,"Maecenas leo odio, condimentum id, luctus nec, molestie sed, justo. Pellentesque viverra pede ac diam. Cras pellentesque volutpat dui.","Duis bibendum, felis sed interdum venenatis, turpis enim blandit mi, in porttitor pede justo eu massa. Donec dapibus. Duis at velit eu est congue elementum.",Reviewing
513,100,973,31/07/2021 1:29,IntegerTinciduntAnte.doc,Etiam vel augue. Vestibulum rutrum rutrum neque. Aenean auctor gravida sem.,"Proin leo odio, porttitor id, consequat in, consequat ut, nulla. Sed accumsan felis. Ut at dolor quis odio consequat varius.",Aliquam quis turpis eget elit sodales scelerisque. Mauris sit amet eros. Suspendisse accumsan tortor quis turpis.,Reviewing
538,560,340,28/04/2021 23:46,NuncDonec.gif,Duis consequat dui nec nisi volutpat eleifend. Donec ut dolor. Morbi vel lectus in quam fringilla rhoncus.,Pellentesque at nulla. Suspendisse potenti. Cras in purus eu magna vulputate luctus.,In quis justo. Maecenas rhoncus aliquam lacus. Morbi quis tortor id nulla ultrices aliquet.,Reviewing
540,504,665,14/02/2021 10:21,Nisl.ppt,Phasellus in felis. Donec semper sapien a libero. Nam dui.,Duis aliquam convallis nunc. Proin at turpis a pede posuere nonummy. Integer non velit.,,Reviewing
541,970,592,16/03/2021 7:38,MagnaVestibulumAliquet.jpeg,Maecenas ut massa quis augue luctus tincidunt. Nulla mollis molestie lorem. Quisque ut erat.,In hac habitasse platea dictumst. Etiam faucibus cursus urna. Ut tellus.,Aliquam quis turpis eget elit sodales scelerisque. Mauris sit amet eros. Suspendisse accumsan tortor quis turpis.,Reviewing
555,720,646,30/06/2021 0:20,PurusSitAmet.tiff,Sed ante. Vivamus tortor. Duis mattis egestas metus.,"Vestibulum quam sapien, varius ut, blandit non, interdum in, ante. Vestibulum ante ipsum primis in faucibus orci luctus et ultrices posuere cubilia Curae; Duis faucibus accumsan odio. Curabitur convallis.","In hac habitasse platea dictumst. Morbi vestibulum, velit id pretium iaculis, diam erat fermentum justo, nec condimentum neque sapien placerat ante. Nulla justo.",Reviewing
556,681,999,15/08/2021 2:26,InPurus.tiff,Pellentesque at nulla. Suspendisse potenti. Cras in purus eu magna vulputate luctus.,"Morbi non lectus. Aliquam sit amet diam in magna bibendum imperdiet. Nullam orci pede, venenatis non, sodales sed, tincidunt eu, felis.",,Reviewing
568,223,721,18/01/2021 18:26,Tortor.jpeg,"Sed sagittis. Nam congue, risus semper porta volutpat, quam pede lobortis ligula, sit amet eleifend pede libero quis orci. Nullam molestie nibh in lectus.","Praesent blandit. Nam nulla. Integer pede justo, lacinia eget, tincidunt eget, tempus vel, pede.",,Reviewing
569,32,644,28/04/2021 14:30,CuraeDonecPharetra.mp3,"Lorem ipsum dolor sit amet, consectetuer adipiscing elit. Proin risus. Praesent lectus.","Morbi porttitor lorem id ligula. Suspendisse ornare consequat lectus. In est risus, auctor sed, tristique in, tempus sit amet, sem.",Fusce consequat. Nulla nisl. Nunc nisl.,Reviewing
571,446,158,23/02/2021 4:42,AcEnim.txt,"Cum sociis natoque penatibus et magnis dis parturient montes, nascetur ridiculus mus. Vivamus vestibulum sagittis sapien. Cum sociis natoque penatibus et magnis dis parturient montes, nascetur ridiculus mus.",Fusce consequat. Nulla nisl. Nunc nisl.,"Cum sociis natoque penatibus et magnis dis parturient montes, nascetur ridiculus mus. Vivamus vestibulum sagittis sapien. Cum sociis natoque penatibus et magnis dis parturient montes, nascetur ridiculus mus.",Reviewing
588,988,515,17/11/2021 23:32,NuncRhoncus.ppt,"Duis bibendum, felis sed interdum venenatis, turpis enim blandit mi, in porttitor pede justo eu massa. Donec dapibus. Duis at velit eu est congue elementum.",Nullam sit amet turpis elementum ligula vehicula consequat. Morbi a ipsum. Integer a nibh.,"In sagittis dui vel nisl. Duis ac nibh. Fusce lacus purus, aliquet at, feugiat non, pretium quis, lectus.",Reviewing
589,627,198,14/07/2021 21:16,LuctusCum.png,Phasellus in felis. Donec semper sapien a libero. Nam dui.,"In sagittis dui vel nisl. Duis ac nibh. Fusce lacus purus, aliquet at, feugiat non, pretium quis, lectus.","Curabitur gravida nisi at nibh. In hac habitasse platea dictumst. Aliquam augue quam, sollicitudin vitae, consectetuer eget, rutrum at, lorem.",Reviewing
594,464,357,06/11/2021 1:06,Laoreet.xls,Aenean lectus. Pellentesque eget nunc. Donec quis orci eget orci vehicula condimentum.,"Proin eu mi. Nulla ac enim. In tempor, turpis nec euismod scelerisque, quam turpis adipiscing lorem, vitae mattis nibh ligula nec sem.","Proin leo odio, porttitor id, consequat in, consequat ut, nulla. Sed accumsan felis. Ut at dolor quis odio consequat varius.",Reviewing
601,947,921,19/01/2021 22:26,Hac.pdf,"In sagittis dui vel nisl. Duis ac nibh. Fusce lacus purus, aliquet at, feugiat non, pretium quis, lectus.","Cras mi pede, malesuada in, imperdiet et, commodo vulputate, justo. In blandit ultrices enim. Lorem ipsum dolor sit amet, consectetuer adipiscing elit.",Phasellus in felis. Donec semper sapien a libero. Nam dui.,Reviewing
602,252,778,25/08/2021 6:42,AccumsanTellusNisi.xls,In hac habitasse platea dictumst. Etiam faucibus cursus urna. Ut tellus.,Duis consequat dui nec nisi volutpat eleifend. Donec ut dolor. Morbi vel lectus in quam fringilla rhoncus.,"Vestibulum quam sapien, varius ut, blandit non, interdum in, ante. Vestibulum ante ipsum primis in faucibus orci luctus et ultrices posuere cubilia Curae; Duis faucibus accumsan odio. Curabitur convallis.",Reviewing
605,336,530,29/11/2021 20:26,CrasMiPede.mp3,Fusce consequat. Nulla nisl. Nunc nisl.,Integer tincidunt ante vel ipsum. Praesent blandit lacinia erat. Vestibulum sed magna at nunc commodo placerat.,Nulla ut erat id mauris vulputate elementum. Nullam varius. Nulla facilisi.,Reviewing
614,436,733,02/05/2021 15:12,OrciMaurisLacinia.ppt,"Maecenas tristique, est et tempus semper, est quam pharetra magna, ac consequat metus sapien ut nunc. Vestibulum ante ipsum primis in faucibus orci luctus et ultrices posuere cubilia Curae; Mauris viverra diam vitae quam. Suspendisse potenti.",In congue. Etiam justo. Etiam pretium iaculis justo.,"Quisque id justo sit amet sapien dignissim vestibulum. Vestibulum ante ipsum primis in faucibus orci luctus et ultrices posuere cubilia Curae; Nulla dapibus dolor vel est. Donec odio justo, sollicitudin ut, suscipit a, feugiat et, eros.",Reviewing
623,27,157,15/11/2021 18:16,AeneanSit.jpeg,"Proin eu mi. Nulla ac enim. In tempor, turpis nec euismod scelerisque, quam turpis adipiscing lorem, vitae mattis nibh ligula nec sem.","Vestibulum quam sapien, varius ut, blandit non, interdum in, ante. Vestibulum ante ipsum primis in faucibus orci luctus et ultrices posuere cubilia Curae; Duis faucibus accumsan odio. Curabitur convallis.",,Reviewing
627,878,639,26/07/2021 5:01,Integer.xls,"Lorem ipsum dolor sit amet, consectetuer adipiscing elit. Proin risus. Praesent lectus.","Sed sagittis. Nam congue, risus semper porta volutpat, quam pede lobortis ligula, sit amet eleifend pede libero quis orci. Nullam molestie nibh in lectus.","Quisque porta volutpat erat. Quisque erat eros, viverra eget, congue eget, semper rutrum, nulla. Nunc purus.",Reviewing
629,152,464,22/10/2021 9:53,LaciniaNisi.ppt,Cras non velit nec nisi vulputate nonummy. Maecenas tincidunt lacus at velit. Vivamus vel nulla eget eros elementum pellentesque.,Fusce consequat. Nulla nisl. Nunc nisl.,Cras non velit nec nisi vulputate nonummy. Maecenas tincidunt lacus at velit. Vivamus vel nulla eget eros elementum pellentesque.,Reviewing
635,122,635,21/08/2021 9:59,InHac.ppt,Fusce consequat. Nulla nisl. Nunc nisl.,"Aenean fermentum. Donec ut mauris eget massa tempor convallis. Nulla neque libero, convallis eget, eleifend luctus, ultricies eu, nibh.","Curabitur at ipsum ac tellus semper interdum. Mauris ullamcorper purus sit amet nulla. Quisque arcu libero, rutrum ac, lobortis vel, dapibus at, diam.",Reviewing
644,487,767,28/05/2021 18:36,Tortor.xls,"Aenean fermentum. Donec ut mauris eget massa tempor convallis. Nulla neque libero, convallis eget, eleifend luctus, ultricies eu, nibh.","Quisque porta volutpat erat. Quisque erat eros, viverra eget, congue eget, semper rutrum, nulla. Nunc purus.",Duis bibendum. Morbi non quam nec dui luctus rutrum. Nulla tellus.,Reviewing
649,297,828,20/06/2021 15:45,PretiumIaculis.xls,Aenean lectus. Pellentesque eget nunc. Donec quis orci eget orci vehicula condimentum.,"Curabitur in libero ut massa volutpat convallis. Morbi odio odio, elementum eu, interdum eu, tincidunt in, leo. Maecenas pulvinar lobortis est.",In hac habitasse platea dictumst. Etiam faucibus cursus urna. Ut tellus.,Reviewing
650,264,83,27/03/2021 2:30,PretiumIaculisDiam.ppt,"Vestibulum quam sapien, varius ut, blandit non, interdum in, ante. Vestibulum ante ipsum primis in faucibus orci luctus et ultrices posuere cubilia Curae; Duis faucibus accumsan odio. Curabitur convallis.",Duis consequat dui nec nisi volutpat eleifend. Donec ut dolor. Morbi vel lectus in quam fringilla rhoncus.,,Reviewing
651,327,572,30/12/2021 21:07,DolorVelEst.mpeg,"Vestibulum ac est lacinia nisi venenatis tristique. Fusce congue, diam id ornare imperdiet, sapien urna pretium nisl, ut volutpat sapien arcu sed augue. Aliquam erat volutpat.",Sed ante. Vivamus tortor. Duis mattis egestas metus.,Aliquam quis turpis eget elit sodales scelerisque. Mauris sit amet eros. Suspendisse accumsan tortor quis turpis.,Reviewing
656,295,919,18/01/2021 21:56,MagnaBibendum.ppt,Suspendisse potenti. In eleifend quam a odio. In hac habitasse platea dictumst.,"Mauris enim leo, rhoncus sed, vestibulum sit amet, cursus id, turpis. Integer aliquet, massa id lobortis convallis, tortor risus dapibus augue, vel accumsan tellus nisi eu orci. Mauris lacinia sapien quis libero.",Cras non velit nec nisi vulputate nonummy. Maecenas tincidunt lacus at velit. Vivamus vel nulla eget eros elementum pellentesque.,Reviewing
660,924,278,18/03/2021 10:26,NullaElit.avi,Nullam sit amet turpis elementum ligula vehicula consequat. Morbi a ipsum. Integer a nibh.,Nullam sit amet turpis elementum ligula vehicula consequat. Morbi a ipsum. Integer a nibh.,"Sed sagittis. Nam congue, risus semper porta volutpat, quam pede lobortis ligula, sit amet eleifend pede libero quis orci. Nullam molestie nibh in lectus.",Reviewing
662,883,338,07/07/2021 23:26,QuamA.png,"Vestibulum quam sapien, varius ut, blandit non, interdum in, ante. Vestibulum ante ipsum primis in faucibus orci luctus et ultrices posuere cubilia Curae; Duis faucibus accumsan odio. Curabitur convallis.","Praesent blandit. Nam nulla. Integer pede justo, lacinia eget, tincidunt eget, tempus vel, pede.","Cum sociis natoque penatibus et magnis dis parturient montes, nascetur ridiculus mus. Vivamus vestibulum sagittis sapien. Cum sociis natoque penatibus et magnis dis parturient montes, nascetur ridiculus mus.",Reviewing
664,572,572,06/11/2021 18:38,NullaPede.avi,"Sed sagittis. Nam congue, risus semper porta volutpat, quam pede lobortis ligula, sit amet eleifend pede libero quis orci. Nullam molestie nibh in lectus.",Sed ante. Vivamus tortor. Duis mattis egestas metus.,,Reviewing
678,507,30,30/12/2021 21:42,Molestie.avi,"Cum sociis natoque penatibus et magnis dis parturient montes, nascetur ridiculus mus. Vivamus vestibulum sagittis sapien. Cum sociis natoque penatibus et magnis dis parturient montes, nascetur ridiculus mus.","Vestibulum quam sapien, varius ut, blandit non, interdum in, ante. Vestibulum ante ipsum primis in faucibus orci luctus et ultrices posuere cubilia Curae; Duis faucibus accumsan odio. Curabitur convallis.",Phasellus in felis. Donec semper sapien a libero. Nam dui.,Reviewing
680,318,309,22/08/2021 15:11,MaurisEnimLeo.jpeg,"Vestibulum quam sapien, varius ut, blandit non, interdum in, ante. Vestibulum ante ipsum primis in faucibus orci luctus et ultrices posuere cubilia Curae; Duis faucibus accumsan odio. Curabitur convallis.",Pellentesque at nulla. Suspendisse potenti. Cras in purus eu magna vulputate luctus.,,Reviewing
683,918,456,06/06/2021 22:18,CrasPellentesque.avi,"Quisque porta volutpat erat. Quisque erat eros, viverra eget, congue eget, semper rutrum, nulla. Nunc purus.","Mauris enim leo, rhoncus sed, vestibulum sit amet, cursus id, turpis. Integer aliquet, massa id lobortis convallis, tortor risus dapibus augue, vel accumsan tellus nisi eu orci. Mauris lacinia sapien quis libero.",Nullam porttitor lacus at turpis. Donec posuere metus vitae ipsum. Aliquam non mauris.,Reviewing
684,593,859,28/02/2021 11:49,VelitEuEst.ppt,"Curabitur gravida nisi at nibh. In hac habitasse platea dictumst. Aliquam augue quam, sollicitudin vitae, consectetuer eget, rutrum at, lorem.","Curabitur gravida nisi at nibh. In hac habitasse platea dictumst. Aliquam augue quam, sollicitudin vitae, consectetuer eget, rutrum at, lorem.",Duis consequat dui nec nisi volutpat eleifend. Donec ut dolor. Morbi vel lectus in quam fringilla rhoncus.,Reviewing
693,770,510,05/10/2021 22:51,AmetConsectetuerAdipiscing.pdf,Suspendisse potenti. In eleifend quam a odio. In hac habitasse platea dictumst.,"Maecenas leo odio, condimentum id, luctus nec, molestie sed, justo. Pellentesque viverra pede ac diam. Cras pellentesque volutpat dui.","Maecenas tristique, est et tempus semper, est quam pharetra magna, ac consequat metus sapien ut nunc. Vestibulum ante ipsum primis in faucibus orci luctus et ultrices posuere cubilia Curae; Mauris viverra diam vitae quam. Suspendisse potenti.",Reviewing
695,28,297,15/07/2021 18:31,Rutrum.mpeg,Nullam porttitor lacus at turpis. Donec posuere metus vitae ipsum. Aliquam non mauris.,In quis justo. Maecenas rhoncus aliquam lacus. Morbi quis tortor id nulla ultrices aliquet.,"Vestibulum ac est lacinia nisi venenatis tristique. Fusce congue, diam id ornare imperdiet, sapien urna pretium nisl, ut volutpat sapien arcu sed augue. Aliquam erat volutpat.",Reviewing
698,577,123,15/11/2021 3:52,VolutpatQuam.gif,"Aenean fermentum. Donec ut mauris eget massa tempor convallis. Nulla neque libero, convallis eget, eleifend luctus, ultricies eu, nibh.",Etiam vel augue. Vestibulum rutrum rutrum neque. Aenean auctor gravida sem.,Etiam vel augue. Vestibulum rutrum rutrum neque. Aenean auctor gravida sem.,Reviewing
705,879,963,31/08/2021 21:20,Pharetra.xls,"Fusce posuere felis sed lacus. Morbi sem mauris, laoreet ut, rhoncus aliquet, pulvinar sed, nisl. Nunc rhoncus dui vel sem.","Donec diam neque, vestibulum eget, vulputate ut, ultrices vel, augue. Vestibulum ante ipsum primis in faucibus orci luctus et ultrices posuere cubilia Curae; Donec pharetra, magna vestibulum aliquet ultrices, erat tortor sollicitudin mi, sit amet lobortis sapien sapien non mi. Integer ac neque.",In congue. Etiam justo. Etiam pretium iaculis justo.,Reviewing
707,797,435,16/11/2021 3:15,Venenatis.doc,Pellentesque at nulla. Suspendisse potenti. Cras in purus eu magna vulputate luctus.,"In sagittis dui vel nisl. Duis ac nibh. Fusce lacus purus, aliquet at, feugiat non, pretium quis, lectus.","Quisque porta volutpat erat. Quisque erat eros, viverra eget, congue eget, semper rutrum, nulla. Nunc purus.",Reviewing
716,997,738,03/09/2021 1:28,EuSapienCursus.txt,"Mauris enim leo, rhoncus sed, vestibulum sit amet, cursus id, turpis. Integer aliquet, massa id lobortis convallis, tortor risus dapibus augue, vel accumsan tellus nisi eu orci. Mauris lacinia sapien quis libero.",Maecenas ut massa quis augue luctus tincidunt. Nulla mollis molestie lorem. Quisque ut erat.,In congue. Etiam justo. Etiam pretium iaculis justo.,Reviewing
718,184,313,02/04/2021 11:06,Bibendum.xls,Sed ante. Vivamus tortor. Duis mattis egestas metus.,"Maecenas leo odio, condimentum id, luctus nec, molestie sed, justo. Pellentesque viverra pede ac diam. Cras pellentesque volutpat dui.","Duis bibendum, felis sed interdum venenatis, turpis enim blandit mi, in porttitor pede justo eu massa. Donec dapibus. Duis at velit eu est congue elementum.",Reviewing
740,551,919,12/01/2021 6:01,Nonummy.mp3,"Maecenas leo odio, condimentum id, luctus nec, molestie sed, justo. Pellentesque viverra pede ac diam. Cras pellentesque volutpat dui.",Fusce consequat. Nulla nisl. Nunc nisl.,"Curabitur in libero ut massa volutpat convallis. Morbi odio odio, elementum eu, interdum eu, tincidunt in, leo. Maecenas pulvinar lobortis est.",Reviewing
746,648,538,08/02/2021 20:20,InHacHabitasse.ppt,"Aenean fermentum. Donec ut mauris eget massa tempor convallis. Nulla neque libero, convallis eget, eleifend luctus, ultricies eu, nibh.","Sed sagittis. Nam congue, risus semper porta volutpat, quam pede lobortis ligula, sit amet eleifend pede libero quis orci. Nullam molestie nibh in lectus.",Nulla ut erat id mauris vulputate elementum. Nullam varius. Nulla facilisi.,Reviewing
748,976,207,10/05/2021 13:27,Metus.mp3,Duis aliquam convallis nunc. Proin at turpis a pede posuere nonummy. Integer non velit.,Nullam porttitor lacus at turpis. Donec posuere metus vitae ipsum. Aliquam non mauris.,"Curabitur in libero ut massa volutpat convallis. Morbi odio odio, elementum eu, interdum eu, tincidunt in, leo. Maecenas pulvinar lobortis est.",Reviewing
763,454,111,03/12/2021 19:30,Cum.mp3,Pellentesque at nulla. Suspendisse potenti. Cras in purus eu magna vulputate luctus.,"Praesent blandit. Nam nulla. Integer pede justo, lacinia eget, tincidunt eget, tempus vel, pede.",In hac habitasse platea dictumst. Etiam faucibus cursus urna. Ut tellus.,Reviewing
782,804,112,21/09/2021 2:28,ConsequatNullaNisl.avi,"Aenean fermentum. Donec ut mauris eget massa tempor convallis. Nulla neque libero, convallis eget, eleifend luctus, ultricies eu, nibh.",Phasellus sit amet erat. Nulla tempus. Vivamus in felis eu sapien cursus vestibulum.,,Reviewing
799,446,95,23/05/2021 10:14,NonQuam.xls,"Sed sagittis. Nam congue, risus semper porta volutpat, quam pede lobortis ligula, sit amet eleifend pede libero quis orci. Nullam molestie nibh in lectus.",Phasellus in felis. Donec semper sapien a libero. Nam dui.,Nullam porttitor lacus at turpis. Donec posuere metus vitae ipsum. Aliquam non mauris.,Reviewing
801,99,761,15/11/2021 11:34,NasceturRidiculusMus.txt,"Proin leo odio, porttitor id, consequat in, consequat ut, nulla. Sed accumsan felis. Ut at dolor quis odio consequat varius.",Aliquam quis turpis eget elit sodales scelerisque. Mauris sit amet eros. Suspendisse accumsan tortor quis turpis.,Duis aliquam convallis nunc. Proin at turpis a pede posuere nonummy. Integer non velit.,Reviewing
805,186,502,24/04/2021 21:55,TristiqueFusce.mp3,Duis bibendum. Morbi non quam nec dui luctus rutrum. Nulla tellus.,"Morbi porttitor lorem id ligula. Suspendisse ornare consequat lectus. In est risus, auctor sed, tristique in, tempus sit amet, sem.",Integer ac leo. Pellentesque ultrices mattis odio. Donec vitae nisi.,Reviewing
812,5,543,10/10/2021 17:38,LacusAt.pdf,In quis justo. Maecenas rhoncus aliquam lacus. Morbi quis tortor id nulla ultrices aliquet.,"Vestibulum ac est lacinia nisi venenatis tristique. Fusce congue, diam id ornare imperdiet, sapien urna pretium nisl, ut volutpat sapien arcu sed augue. Aliquam erat volutpat.","Sed sagittis. Nam congue, risus semper porta volutpat, quam pede lobortis ligula, sit amet eleifend pede libero quis orci. Nullam molestie nibh in lectus.",Reviewing
817,371,847,02/09/2021 5:15,Lectus.xls,Fusce consequat. Nulla nisl. Nunc nisl.,Fusce consequat. Nulla nisl. Nunc nisl.,,Reviewing
822,49,550,07/07/2021 15:48,LuctusUltriciesEu.xls,"Morbi non lectus. Aliquam sit amet diam in magna bibendum imperdiet. Nullam orci pede, venenatis non, sodales sed, tincidunt eu, felis.","Cum sociis natoque penatibus et magnis dis parturient montes, nascetur ridiculus mus. Vivamus vestibulum sagittis sapien. Cum sociis natoque penatibus et magnis dis parturient montes, nascetur ridiculus mus.",,Reviewing
824,644,717,24/04/2021 6:58,UtNuncVestibulum.avi,"Cras mi pede, malesuada in, imperdiet et, commodo vulputate, justo. In blandit ultrices enim. Lorem ipsum dolor sit amet, consectetuer adipiscing elit.","Cum sociis natoque penatibus et magnis dis parturient montes, nascetur ridiculus mus. Vivamus vestibulum sagittis sapien. Cum sociis natoque penatibus et magnis dis parturient montes, nascetur ridiculus mus.",Phasellus sit amet erat. Nulla tempus. Vivamus in felis eu sapien cursus vestibulum.,Reviewing
837,218,313,29/09/2021 3:54,Mauris.doc,"Morbi non lectus. Aliquam sit amet diam in magna bibendum imperdiet. Nullam orci pede, venenatis non, sodales sed, tincidunt eu, felis.","Duis bibendum, felis sed interdum venenatis, turpis enim blandit mi, in porttitor pede justo eu massa. Donec dapibus. Duis at velit eu est congue elementum.",In quis justo. Maecenas rhoncus aliquam lacus. Morbi quis tortor id nulla ultrices aliquet.,Reviewing
